{
  "log_version": "1.0",
  "source_ir_id": "ir.monopoly.phase11_task09b_mcp_agent.20260416",
  "entries": [
    {
      "ir_action_id": "bir_001_board_topology_spec",
      "action": "create_cpp_class",
      "source_skill_instance_id": "skill-board-topology",
      "naming_resolution_log": {
        "class_name": {
          "resolved": "AMonopolyBoard",
          "tier": 2,
          "evidence": "依据 contract_id 推导项目风格命名：Monopoly",
          "alternatives_considered": [
            "ABoard",
            "ABoardTopology"
          ]
        },
        "file_path": {
          "resolved": "Source/Mvpv4TestCodex/Board/MonopolyBoard.h",
          "tier": 3,
          "evidence": "项目规范：Source/Mvpv4TestCodex/Board/",
          "alternatives_considered": []
        },
        "asset_path": {
          "resolved": "/Game/Mvpv4TestCodex/Blueprints/Board/BP_MonopolyBoard",
          "tier": 3,
          "evidence": "项目规范：/Game/Mvpv4TestCodex/ 按 UE5 前缀落盘",
          "alternatives_considered": []
        }
      }
    }
  ],
  "summary": {
    "total_actions": 1,
    "resolved_fields": 3,
    "by_tier": {
      "2": 1,
      "3": 2
    }
  },
  "metadata": {
    "generated_at": "2026-04-16T13:35:15.353406+00:00",
    "generator": "AgentBridge.Compiler.LoweringV2.NamingResolver.v2"
  }
}